4365801484066401	,HrBNqh3R7,同理还有看纸牌屋/ West Wing 学政治，看 Newsroom 学新闻，靠综艺真人秀想象各种职业，以及靠官方访谈了解一个人,,,,,,2019-04-27T21:27:29,微博轻享版,277,19,66,,,2019-04-27 21:27:29,False,0,False,1977585731,VicodinXYZ,4365798862820353	,HrBJcbPHz,看《Billions》学投资基本上和看 Pornhub 学谈恋爱差不多。 ,,,,,,2019-04-27T21:17:04,iPhone X,273,3,118,,,2019-04-27 21:17:04
4365756017579542	,HrAC5vNMG,观察类真人秀，有点像现代版罗马斗兽场 ,,,,,,2019-04-27T18:26:49,iPhone客户端,118,8,7,,,2019-04-27 18:26:49,False,0,True
4365689760256634	,HryTe14Lg,有时候喝着咖啡都要感慨一句，「乾隆爷都没喝过这么好的咖啡，真是要感谢现代科技。」 ,,,,,,2019-04-27T14:03:32,iPhone客户端,276,27,9,,,2019-04-27 14:03:32,False,0,True
4365674669059506	,HryuSC0N4,"当你不确定对面说话的人是在瞎掰还是真的懂的时候，就让他举个例子。 
“Can you give me an example?” 是我的面试金句。 ",,,,,,2019-04-27T13:03:34,iPhone客户端,250,31,31,,,2019-04-27 13:03:34,True,1,True
4365663441606787	,HrycM6JZV,看了一些老爷车的电视，在想为什么过去车企会做一堆奇奇怪怪的、只生产几百辆的车，现在好像就没大有了？是因为设计者的想象力变弱了、消费者审美品位更大众了、还是试错成本更高了？ ,,,,,,2019-04-27T12:18:57,微博轻享版,43,27,1,,,2019-04-27 12:18:57,False,0,True
4364195182552643	,HqW0CaI3F,女性最深层的安全感从来不来自男性，而是来自她们裙子里的兜和手腕上的发圈。 ,,,,,,2019-04-23T11:04:38,iPhone客户端,646,73,57,,,2019-04-23 11:04:38,False,0,True
4363877229656969	,HqNJMEwdz,这个时代不是没有诗人了，他们只是去做了广告文案 ,,,,,,2019-04-22T14:01:10,iPhone客户端,694,65,67,,,2019-04-22 14:01:10,False,0,True
4363869457599608	,HqNxfvT0k,苹果太厉害了，试问全天下哪个公司不想研制出一款像 airpods 一样又贵又好用又容易丢的产品 ,,,,,,2019-04-22T13:30:18,微博轻享版,11335,3379,7524,,,2019-04-22 13:30:18,True,2,True
4363862222677882	,HqNlAbeDE,这是一条造句微博，格式：前半句是「我希望每个我关心的人都…」，后半句是我的推荐。内容在评论里。也欢迎大家参与。 ,,,,,,2019-04-22T13:01:32,iPhone客户端,183,298,125,,,2019-04-22 13:01:32,False,0,True
4363651895479745	,HqHSlmZwZ,深夜读博尔赫斯，他引《奥德赛》：「众神编织不幸，为了让后世的人们有事情可以歌唱」。残忍，但令人安心。 ,,,,,,2019-04-21T23:05:46,iPhone客户端,430,14,55,,,2019-04-21 23:05:46,True,1,True
4363489235590869	,HqDDZnsrj,我讨厌有的故事用喜剧把观众带入然后突然急转笔锋来个悲剧结尾，让人伤个措手不及。这招太 cheap 了，越想越生气。你把喜剧当什么了。 ,,,,,,2019-04-21T12:19:26,微博轻享版,197,35,20,,,2019-04-21 12:19:26,True,1,True
4363131733678557	,HqulnfqXz,从头到尾就是两回事儿。自己选择的难题，解不出来了叫挫折，迈过去了叫成长。只要是没得选的，无论是天降还是人为，都只能叫悲剧。悲剧是无从化解的，所有能从悲剧中找补出来的益处，都是自我安慰。一件事无论最后结局是好是坏，当你问自己一个问题，“如果这件事当初有得选，你会希望它发生吗？”，答案是否定的，那么它就是一桩悲剧。那些被命运牵着鼻子跑、别无选择的时刻，我祝福这个世界的所有人，能少感受一点是一点。除非是你缴械投降，自愿把手交给了命运，那也得是你自己的选择才行。以后送人祝福，就送「祝你永远有所选择」，那才是终极幸运。,,,,,,2019-04-20T12:38:51,iPhone客户端,794,21,176,,,2019-04-20 12:38:51,False,0,True
4363125300524917	,Hqub02cyp,挫折教育的说法真是太恶臭了。我在外部世界遇到过很多难题，碰到过难缠的教授，待过糟糕的公司，做过难度极高的项目，被不顺利的亲密关系伤害过，也因为自己的无能深陷过抑郁的情绪，但没有一次，真的没有一次，让我觉得这些外部的挫折比我青春期遇到过的为了所谓「挫折教育」而受到的挫折更难、更无力、更伤心和恶心。成年人可以为自己所选择的难题负责，能够寻求帮助和支持，实在不行还有权放弃，未成年人有什么呢？「在父母和孩子的斗争中，我永远站在孩子那一边。」,,,,,,2019-04-20T12:13:17,iPhone客户端,752,59,163,,,2019-04-20 12:13:17,True,2,True
4362426264852700	,HqbZwkmpm,我是一个没有感情的提案员。我的武器是一个 HDMI to Type-C 转接头。 ,,,,,,2019-04-18T13:55:34,iPhone客户端,84,13,5,,,2019-04-18 13:55:34,False,0,True
4361463227493606	,HpMWevrqC,"今天久违地去讲了一下开放麦，讲垮了，不是一般的烂，站在台上已经不知道手脚要放哪，语法破碎，节奏糟糕，讲到一半的时候已经知道完了，但时间还没到，只能胡言乱语撑下去，简直不敢看观众，下台也不好意思和其他演员打招呼。
但讲完之后走在路上觉得很开心，甚至也是久违的开心。想了想觉得原因可能是，现代生活中的人类太难体会彻底的失败了。我们生活里的观众是我们经常要见面的人，无论同事朋友还是家人，他们都习惯对你充满鼓励，那种鼓励时常会是善意的谎言，再加上人天生就擅长自我安慰，如果你不经常把自己置于陌生的环境，那么体验完全的失败简直是一种奢侈品。长大了的我们很少有契机去参加考试和比赛了，能获得立竿见影而且绝对真实的评价的机会不多，开放麦算一个。观众会是冷酷无情而且直率真诚的，在气氛糟糕的时候，他们哪怕想要礼貌，都无法逼迫自己笑出声来。这挺残忍，但对习惯了浑浑噩噩活着的现代人，也是一种难得。「最差的现实也胜过最美妙的谎言」，我所感受到的让我振奋的能量，可能就来自于这种真实吧。
还能允许甚至要求自己去拥有全然的失败，好像也是某种年轻人的特权，也能代表勇气和远大前程。如果品尝剧烈的胜利不是一个人生的选项，体验几次彻底的失败也未尝不可。推荐大家有时间试试。痛并快乐。",,,,,,2019-04-15T22:08:48,微博轻享版,413,60,64,,,2019-04-15 22:08:48,True,2,True
4361452480903335	,HpMEU3MZV,要猜一个团队里谁是老板很简单，观察谁不带电脑就行了 ,,,,,,2019-04-15T21:26:06,微博轻享版,123,19,5,,,2019-04-15 21:26:06,False,0,True
4361296012997640	,HpIAxczP2,Cyborg 这个概念很恐怖，但如果在我耳膜内植入一对 airpods 我应该不会反对，因为这已经是我丢的第二副了 ,,,,,,2019-04-15T11:04:21,微博轻享版,49,12,5,,,2019-04-15 11:04:21,False,0,True
4360604577592230	,HpqBjvR5k,车里放谁的歌才决定了谁是一家之主 ,,,,,,2019-04-13T13:16:50,微博轻享版,267,31,33,,,2019-04-13 13:16:50,False,0,True
4360597896429350	,HpqqxqYzc,"自洽的人就完了。「完了」不是个坏事儿，就是完成了的意思。但我还是倾向于这么说，自洽的人就完了，like finished, period. ",,,,,,2019-04-13T12:50:16,微博轻享版,133,16,20,,,2019-04-13 12:50:16,True,1,True
4360595291445447	,Hpqml641F,今年宇宙向我发来的所有信号，翻译成人话都是「你是不是太努力了」。宇宙老师太伤人了。 ,,,,,,2019-04-13T12:39:56,微博轻享版,111,15,9,,,2019-04-13 12:39:56,False,0,True
4359867844058029	,Hp7r2h1G5,美丽新世界,,,,,,2019-04-11T12:29:19,微博轻享版,251,9,67,,,2019-04-11 12:29:19,False,0,False,,,4359600792366459	,Hp0uj9VCH,抱歉，根据作者设置的微博可见时间范围，此微博已不可见。 ,,,,,,2019-04-10T18:48:09,,0,0,0,,,2019-04-10 18:48:09
4359636871705643	,Hp1qv79In,老大不小了，遇到可爱的人类还是不知道该如何自然相处。如何委婉、不带性意味而清楚地对萍水相逢的人表达“I like you. We should hang out. Let’s be friends!” 这层意思呢。挺难的，都是信号和信号猜来猜去，我有时候经常一激动就干脆把这三句话说出去了，然后吓到别人。在交朋友的水平上，我可能还是小学生。,,,,,,2019-04-10T21:11:31,微博轻享版,700,135,218,,,2019-04-10 21:11:31,False,0,True
4359530991196091	,HoYFJ519N,「好大的口气！」，一个口香糖广告slogan. ,,,,,,2019-04-10T14:10:47,微博轻享版,82,13,2,,,2019-04-10 14:10:47,True,2,True
4358579093728444	,HozUpfDWc,真好啊。和大家一起好好长大，互相支撑，各自发出一些微弱的信号，有一天说不定能彼此相认。我想不到比这更温暖的事情了。,,,,,,2019-04-07T23:08:17,微博轻享版,171,20,12,,,2019-04-07 23:08:17,False,0,False,5826323992,巴别塔乐园改造计划,4358566913041976	,HozALcLm8,"又看到@中二怪 老师发人贩帖子了。
第一次看到她发人贩帖的时候我还不知道她是男是女，好像是她被我喜欢的博主转发到我首页，我被她首页的内容吸引，就关注了她。后来我炸号，换号又找到她。
我那时有意在扩关，并不知道她会成为其中特殊的一个。（特殊的意思是，她不是一个账号，她成为一个称得上立体的人物形象。）
我慢慢知道了她是笑果的导演，她参与了我喜欢的综艺节目，后来她和我全微博最喜欢的男性博主（强调男性是因为还有一个女性博主并列第一）成为好朋友。
我目睹了他们从刚刚认识到组队偷夏天的过程，也听到他们一起在播客里聊各自对招聘小朋友的看法，再后来我被她鼓舞才下定决心master转专业，然后到了今天看到她发了新的人贩帖子。
时间过得好快，一转眼2019过去了三分之一，大三也快要结束了。
因为炸号，所以并不记得认识她的具体时长，但应该有两年了吧。她的人生有自己的运行轨迹，其中一小部分通过互联网被我看到。而在她没注意到的世界里，我的人生也遇到了很多变化和动荡。我自顾自地经历它们，时而抬头看看她。在这个过程中，她从未认识我，更没有对我说过什么。但我接受到她的信号和她的表达，我被她冲刷了。
朋友追养成系，她总说，她和她的小朋友都有好好长大，互相支撑彼此的梦想。在这一刻我和她完成某种共情。
我被中二怪老师发出的信号指引了，她如果知道的话，也会感到欣慰的吧。",,,,,,2019-04-07T22:19:53,微博轻享版,36,23,14,,中二怪,2019-04-07 22:19:53
4358503033742718	,HoxVJfHEq,"【已截止，谢谢各位关注】
终于，可以发这条人贩广告了：
我们最近一直忙着研发的新项目准备进入执行阶段，在此招募项目所需的三名实习导演，负责策划、内容、艺人统筹等方面。
它会是一个和以往的棚内脱口秀节目比较不同的新模式，更偏泛娱乐方向，关键词包括”公路“和”真人秀“等等，会有一些崭新的元素和火花，涉及部分境外拍摄，嘉宾为一线艺人。因为是全新的项目，你将加入的也会是一个相对年轻的团队，它会更自由、更鼓励新而怪的观点、更容易碰撞出不一样的东西。和以前差不多的是，它仍然会是一个高压高成长的学习机会。
基本信息如下：
公司名：上海笑果文化传媒有限公司（《吐槽大会》、《周六夜现场》的内容生产公司）
候选人范围：工作比较适合在校生或出校门时间不长的小朋友。（此项非硬性要求，不符合这个标准但自己觉得适合的，也可以投投试试。）做得好可以转正。
薪酬：有实习工资
坐标：上海
每周工作时长：每周4天以上坐班时间（此项为硬性要求，请考虑好自己的情况，投递简历即默认可接受四天以上的到岗时长要求。）
项目跨度较长，4-10月，允许阶段性参与，但在同等条件下，我们会优先考虑可以参与的时间较久的候选人。请在后续表格填写中注明你可以参与的时间跨度。
对你的要求（三点中只要有一点达到要求，其他两点不拖后腿即可）：
1. 眼界宽广，知识量高，强 research 能力，善于在海量资料中提取重点并整理成文，各类文字软件使用熟练，文字功底强并且有作品。（需要是拿得出手、体现个人真实水平的作品。尽量不要是”这是我不成熟时写的“/“实在没有，我昨晚现写的”，让大家无法判断的作品。文体内容不限。）
2. 阅片量高，有自己独立的审美判断，对好玩的、美的东西有强烈的野心和敏感，同时能有不错的执行力能让好审美哪怕比较勉强的落地。（希望有相关作品或个人项目可以证明，不限形式）
3. 强大的沟通能力，情商高，喜欢表达，言之有物，在会议中滔滔不绝，在工作交流中不怕尴尬。
不要求你有，但是如果有可以加分的一些点：
1. 之前有过节目录制经验，或者是相关专业出身；
2. 有过后期经验，熟悉相关软件操作；
3. 精通一门外语，并对相关文化有较深的了解和认知。
在这份工作里你可以获得：
1. 既感受大型项目、但同时又能独立操作小型创意环节的机会；
2. 参与前期研发环节，全程了解一个节目从早期策划到实际执行的完整过程；
3. 一个内容题材丰富、高于行业标准的作品集；
4. 一些允许你从零开始、愿意手把手带你的老导演（包括我，不知道算好事坏事）；
5. 和好玩的团队一起工作的经验，感受同时高压和高成就感的创作环境；
6. 如果有志于娱乐行业，这的确会是一个零距离体验它的机会；
4月14日（下周日）23:59分截止，大家有一周时间。所有信息请投递于这个链接中的表格，里面还有一些题目（题挺多的，大家做好准备，需要较长的时间作答）：
网页链接
让我们试着一起做点不一样的事情吧，等你们来",,,,,,2019-04-07T18:06:03,微博 weibo.com,228,127,64,,,2019-04-07 18:06:03,True,2,True
4358238554156550	,Hor39hrj8,好想听小黄人齐声合唱 Game of Thrones，House of Cards 和 Rick and Morty 的片头曲。 ,,,,,,2019-04-07T00:35:06,微博轻享版,104,16,6,,,2019-04-07 00:35:06,False,0,True
4358085194060928	,Hon3Nh2qQ,树太美了。想知道怎么能和一棵树做朋友，能一起出来吃顿饭的那种 ,,https://wx1.sinaimg.cn/large/68bc3885ly1g1swcvk9hij22330u0qv6.jpg,,,,2019-04-06T14:25:42,微博轻享版,464,80,49,,,2019-04-06 14:25:42,True,1,True
4357790900073335	,Hofp80j4P,年纪大了，说的所有话都开始用「年纪大了」开头。 ,,,,,,2019-04-05T18:56:17,iPhone客户端,184,25,20,,,2019-04-05 18:56:17,False,0,True
4357316432733347	,Ho33Rbt4f,"和@蒜留香 老师吃饭，蒜老师：「创作不是一条跑道，不用看别人做了什么然后拿自己的比个输赢，只要把自己想做的东西好好做出来就行了。」
蒜老师还是有人生智慧。 ",,,,,,2019-04-04T11:30:55,iPhone客户端,400,20,183,,蒜留香,2019-04-04 11:30:55,False,0,True
4357282345225373	,Ho2aSlVmd,一旦开始在意「别人怎么看我」，整个人生就动机不纯了。 ,,,,,,2019-04-04T09:15:28,微博轻享版,944,32,160,,,2019-04-04 09:15:28,False,0,True
4357280189901972	,Ho27oFxXe,爱人的怀抱，是现实生活中最接近「结界」的东西。 ,,,,,,2019-04-04T09:06:54,微博轻享版,548,27,101,,,2019-04-04 09:06:54,False,0,True
4357279991745745	,Ho2757k9b,每个早起的人都值得一顿热腾腾的早饭，没有例外 ,,,,,,2019-04-04T09:06:07,微博轻享版,247,17,18,,,2019-04-04 09:06:07,False,0,True
4356232108478112	,HnAQWzzxK,需要涂防晒霜的日子都是好日子 ,,,,,,2019-04-01T11:42:12,微博轻享版,356,42,18,,,2019-04-01 11:42:12,False,0,True
4355219272382489	,Hnavl9ZNf,真好啊 ,,https://wx2.sinaimg.cn/large/68bc3885ly1g1jr4mu1yij21400u00xh.jpg,,,,2019-03-29T16:37:33,iPhone客户端,457,25,103,,,2019-03-29 16:37:33,False,0,True
4354962421051312	,Hn3P44puE,我应该是那种打游戏必须每关打到三星才肯 move on 的人，「我能过游戏这关，但过不了自己这关。」 ,,,,,,2019-03-28T23:36:55,iPhone客户端,167,32,9,,,2019-03-28 23:36:55,False,0,True
4354886043432873	,Hn1PSep2V,提案会就是职场人的竞演舞台 ,,,,,,2019-03-28T18:33:25,微博轻享版,94,4,6,,,2019-03-28 18:33:25,False,0,True
4354630110584429	,HmVb52s2h,"好作品就像性高潮，when you know, you know.  
「没什么可不确定的，心里没底就说明做得还不够好。」来自我的朋友小红。 ",,,,,,2019-03-28T01:36:26,微博轻享版,407,18,48,,,2019-03-28 01:36:26,True,1,True
4354557066669419	,HmThgrZ1h,"很多时候职业的瓶颈可能就出现在，在“逼迫自己必须做一个很不错的东西”和“有效率地做一个稍微差一点但也够用的东西”之间，越来越多的选择了后者。
另一个标准是，在看到“差点意思”的成果的时候，是否要感到不满，甚至发怒；还是觉得达到目的就可以了，要赶紧去做下一件重要的事。这些都是很真切的、没有正确答案的矛盾。
稳定地追求卓越并确立坚定的、完全独立于外界要求的及格线标准，太难了，我身边大概只有个位数的人做得到。对每个能做到的人心怀敬意。",,,,,,2019-03-27T20:46:11,微博轻享版,408,24,132,,,2019-03-27 20:46:11,True,2,True
4353878763987894	,HmBDegJqS,"春天来了，和很久不联系的几个好朋友最近密集地相见，一见就开始猛说，越到后面聊的内容越水，快结束的时候说的几乎已经完全是废话，但还是舍不得走。
其中一个朋友：“我们相处的时间已经多到开始把一样的话说第二遍了，建议我们半年内还是别再见面了。”
我：（猛点头，但心里非常快乐） ",,,,,,2019-03-25T23:50:51,iPhone客户端,423,33,37,,,2019-03-25 23:50:51,True,1,True
4353873491285565	,HmBuJ5oqV,油腻有时是一种能力而非选择，我允许它成为我保护天真的武器。 ,,,,,,2019-03-25T23:29:54,iPhone客户端,220,9,25,,,2019-03-25 23:29:54,False,0,True
4353497350192382	,HmrI30O2W,"有天听 Joe Rogan 和一个欧洲人聊天（忘了是谁），说起美国人挺神奇的一点就在于，他们（哪怕刚认识不久也）可以问彼此一个问题叫 “what’s your story”,  然后对方很多时候就真的会把自己整个人生和盘托出了，“I’m an open book. “ 这点在美国以外的其他地方都是很难想象的。
听完后想到我和人生中最亲密的几个人都没有聊过彼此的 stories，可能是因为还在挣扎，还有秘密，或者是还建立不起一个完整的逻辑通顺的 narrative.  但我也想试试那种能对自己和他人完全诚实并毫无保留的对话，哪怕只有一次，彻底地了解一个人所有能用语言表达出来的部分，并做一本完全打开的书。",,,,,,2019-03-24T22:35:15,微博轻享版,371,62,99,,,2019-03-24 22:35:15,False,0,True
4353493450007191	,HmrBL01RZ,不喜欢昂贵的东西，但允许自己过一种代价昂贵的危险生活，也就是不计回报和后果、天真热诚地对待一切。 ,,,,,,2019-03-24T22:19:44,微博轻享版,568,26,94,,,2019-03-24 22:19:44,False,0,True
4352780049238032	,Hm936CLew,分享一种通过浪费聊天流量来无痛解压的方法 ,,"https://wx2.sinaimg.cn/large/68bc3885gy1g1byzsxx2ej20u01szte2.jpg,https://wx1.sinaimg.cn/large/68bc3885gy1g1byzt07bej20m30e9jss.jpg,https://wx3.sinaimg.cn/large/68bc3885gy1g1byzsxp4cj20u01szwkg.jpg,https://wx3.sinaimg.cn/large/68bc3885gy1g1byzu413mj20u01szhcc.jpg",,,,2019-03-22T23:04:57,微博轻享版,250,96,41,,,2019-03-22 23:04:57,False,0,True
4352230876830744	,HlULlsEZi,苏格拉底，孔子，毛姆，乔治奥威尔，艾柯，福柯，波伏娃，菲茨杰拉德，张岱。目前想听这几个人的播客。 ,,,,,,2019-03-21T10:42:44,微博轻享版,284,59,25,,,2019-03-21 10:42:44,True,1,True
4351984498116373	,HlOlXy3rf,想做播客而不开始，不是办法。 ,,https://wx1.sinaimg.cn/large/68bc3885gy1g19fmlu36pj20uu0uudh7.jpg,,,,2019-03-20T18:23:43,微博轻享版,198,97,11,,,2019-03-20 18:23:43,False,0,True
4351982422734869	,HlOiCbtsN,和 Steve聊 Leaving Neverland 的播客发了，聊了两个多小时，自己也没想到聊到了公民责任和权力关系。以及（半）官宣！我要做播客啦，《不是办法》。让我们谈谈我们糟糕的，逃避的，凑合的人生。,,,,,,2019-03-20T18:15:27,微博轻享版,130,45,15,,,2019-03-20 18:15:27,False,0,False,,,4351959597151197	,HlNHNu0lT,"该账号因违反相关法律法规和政策，现已无法查看。查看帮助
 
网页链接
 ",,,,,,2019-03-20T16:44:45,,0,0,0,,,2019-03-20 16:44:45
4351369370649578	,HlylP2IZ4,这几天做项目的最大感受是，一切作品，无论作者是谁或者 idea 多好，都至少要改到第二稿才能看。#就改吧，勤能补一切 ,,,,,,2019-03-19T01:39:25,微博轻享版,236,16,28,,,2019-03-19 01:39:25,True,1,True
4350495461882080	,HlbCi7TC8,最近一年所有人都在对我说“慢一点，不要着急”。永远极速前进的人生要拉住刹车，那种晕眩感一时间打倒了我。允许自己不时时刻刻 burn out，原来也是功课。 ,,,,,,2019-03-16T15:46:49,微博轻享版,254,11,26,,,2019-03-16 15:46:49,False,0,True
4349498987827481	,HkLH4wQhH,我对痛苦和愤怒的感受常常有好几天甚至好几年的时差，等感受到的时候已经产生了很多利息了，很不值。所以觉得很多人能当下感受并表达痛苦愤怒，也是一种特权或者幸运。 ,,,,,,2019-03-13T21:47:11,微博轻享版,387,37,57,,,2019-03-13 21:47:11,True,1,True
4349367001447068	,HkIgc64rO,林二汶的歌好好听。才知道院线里每次龙标前的电影院礼仪也是她唱的，还真有种破次元壁的感觉 ,,,,,,2019-03-13T13:02:43,iPhone客户端,168,66,8,,,2019-03-13 13:02:43,False,0,True
4349118820774355	,HkBNU3frB,和@史秀雄Steve 老师决定录一期播客聊聊这件事。两个当事人角度的叙述我已经了解了，所以如果有 Michael Jackson 的粉丝，对当年的案子和两个当事人有比较深的了解和资料收集，并且愿意相对客观理性地探讨的，烦请私信我，我想获得比较全面的意见和信息，再做判断。谢谢大家。,,,,,,2019-03-12T20:36:31,微博轻享版,60,21,4,,史秀雄Steve,2019-03-12 20:36:31,False,0,False,1757165701,中二怪,4349002008625868	,HkyLuAbYU,"专门买了HBO，并且花了三天时间终于把《逃离梦幻岛/ Leaving Neverland》看完了。很久没有因为一部电影而感觉到情绪这么带入了，甚至有种强烈的疲惫和痛苦（emotionally exhausting），像那些人都生活在我的身边。很多时候，那种感同身受的幻觉简直吓坏了我。
推荐大家看看吧。无论信不信，无论爱不爱 Michael Jackson（我是年少时非常迷恋他的），可以去看看。先不要轻信任何网络上的碎片化证据。It’s one hell of a story. You should take the tour and check it out yourself.",,,,,,2019-03-12T12:52:22,微博轻享版,148,61,26,,,2019-03-12 12:52:22
4349002008625868	,HkyLuAbYU,"专门买了HBO，并且花了三天时间终于把《逃离梦幻岛/ Leaving Neverland》看完了。很久没有因为一部电影而感觉到情绪这么带入了，甚至有种强烈的疲惫和痛苦（emotionally exhausting），像那些人都生活在我的身边。很多时候，那种感同身受的幻觉简直吓坏了我。
推荐大家看看吧。无论信不信，无论爱不爱 Michael Jackson（我是年少时非常迷恋他的），可以去看看。先不要轻信任何网络上的碎片化证据。It’s one hell of a story. You should take the tour and check it out yourself.",,,,,,2019-03-12T12:52:22,微博轻享版,148,61,26,,,2019-03-12 12:52:22,True,1,True
4347648389999467	,HjZyeFXjJ,我从来不羡慕或者嫉妒任何人，除了，当我看到其他人能有时间、精力、好timing、以及惊人的毅力和勇气做出真正好的作品的时候。我知道我有这些的时候也可以做出来，但我并没有。那是我会嫉妒别人的时刻。好在它是一个可解决的情感。就去创作吧。 ,,,,,,2019-03-08T19:13:33,微博轻享版,596,19,75,,,2019-03-08 19:13:33,False,0,True
4347630844736732	,HjZ5WjSeU,两倍速视频看多了，总觉得现实生活是slow-mo，慢到有点浪漫。人在多种介质、速度和密度之间穿梭，网络加深了这种微妙的失重感 ,,,,,,2019-03-08T18:03:51,微博轻享版,350,7,23,,,2019-03-08 18:03:51,False,0,True
4347371276043690	,HjSlhpmeS,最近频繁地想到这句。它仍然是我巨大的障碍和局限，很难迈过去。我也置顶这条吧。,,,,,,2019-03-08T00:52:25,iPhone客户端,304,9,63,,,2019-03-08 00:52:25,False,0,False,3193891142,小-TEAM,4298625900993493	,GFnI24as5,“漂亮话总是遗患无穷。” 就置顶这条吧。 ,,,,,,2018-10-24T12:35:42,iPhone 6s Plus,434,12,145,,,2018-10-24 12:35:42
4347220167296336	,HjOpyuC6Q,最近的超小型低成本解压方式是在文件传输助手对话框里打一万个啊啊啊啊啊啊啊啊啊发出去 ,,,,,,2019-03-07T14:51:58,iPhone客户端,129,31,19,,,2019-03-07 14:51:58,False,0,True
4347172017187559	,HjN9Tu9On,最近发现听聊天型播客最好的场景是一个人吃饭，像在听拼桌的两个人聊天，很有沉浸感 ,,,,,,2019-03-07T11:40:37,微博轻享版,243,47,23,,,2019-03-07 11:40:37,True,1,True
